Number,Name
v045085,D2ah. Feeling Thermometer - the Catholic Church
v045086,D2aj. Feeling Thermometer: Whites
v045087,D2ak. Feeling Thermometer: Israel
v045088,D2am. Feeling Thermometer: Muslims
v045089,E1a. Which party had most members in House prior to electn
v045090,E1b. Which party had most members in Senate prior to elect
v045091,E1x. Summary: type of House incumbent
v045092,E2. Does R approve/disapprove House incumbent job
v045092a,E2a. How strongly R approves/disapproves House incumbent
v045093,E3a. How often has House incumbent supported President
v045094,E3b. How well House incumbent keeps in touch with district
v045095,E4. How often R follows govt and public affairs
v045096,E5a. Favor incr budget deficit to increase domestic spendg
v045097,E5b. Favor increasing budget deficit to cut taxes
v045098,E5c. Favor reduc spendg on domestic programs to cut taxes
v045099,F1a. US foreign policy goal: preventing spread of nuclear
v045100,F1b. US foreign policy goal: promote human rights
v045101,F1c. US foreign policy goal: strengthen United Nations
v045102,F1d. US foreign policy goal: combating world hunger
v045103,F1e. US foreign policy goal: protect jobs of American wkrs
v045104,F1f. US foreign policy goal: promote democracy
v045105,F1g. US foreign policy goal: control illegal immigration
v045106,F1h. US foreign policy goal: promote market economies abrd
v045107,F1j. US foreign policy goal: combat intl terrorism
v045108,F2. How important is it for US to have strong military
v045109,F3. Have opinion - govt see to fair employmt for blacks
v045109a,F3a. Should government see to fair employment for blacks?
v045109b,F3a1. Strength feels govt should/shd not see to fair empl
v045110,G1a. Favor reduc domestic spend progrs to cut budg deficit
v045111,G1b. Favor increasing taxes to cut budget deficit
v045112,G1c. Favor incr taxes to increase domestic spending progs
v045113,G2a. Change in gap between rich and poor in last 20 yrs
v045113a,G2a1. How much change in gap between rich and poor
v045113b,G2b. Is change in gap between rich and poor good or bad
v045114,G3. Favor or oppose limits on foreign imports
v045115,"G3a. Should immigration be increased, decreased, stay same"
v045116,G3b. Effect of Hispanic immigration: take jobs away
v045117,G4a. Liberal/conservative 7-point scale: self-placement
v045117a,G4a1. If R had to choose lib-con self-placement
v045118,G4ax. Summary: liberal-conservative self-placement
v045119,G4b. Liberal/conservative 7-point scale: US House Dem cand
v045120,G4c. Liberal/conservative 7-point scale: US House Rep cand
v045121,G5a. Services/spending tradeoff 7-pt scale: self-placement
v045122,G5b. Services/spending tradeoff 7-pt scale: Dem House cand
v045123,G5c. Services/spending tradeoff 7-pt scale: Rep House cand
v045124,G6a. Interventionism by diplomacy/military: self-placement
v045125,G6a1. Interventionism by diplomacy/military: importance
v045126,G6b. Interventionism by diplomacy/military: GW Bush
v045127,G6c. Interventionism by diplomacy/military: John Kerry
v045128,G6d. Interventionism by diplomacy/military: Dem House cand
v045129,G6e. Interventionism by diplomacy/military: Rep House cand
v045130,G6f. Interventionism by diplomacy/military: Dem party
v045131,G6g. Interventionism by diplomacy/military: Rep party
v045132,G7a. Abortion position: self-placement
v045133,G7a1. Importance of abortion issue to R
v045134,G7b. Abortion position: GW Bush
v045135,G7c. Abortion position: John Kerry
v045136,G7d. Abortion position: Dem House candidate
v045137,G7e. Abortion position: Rep House candidate
v045138,G7f. Abortion position: Dem party
v045139,G7g. Abortion position: Rep party
v045140,H1a. R position on aid to Hispanic-Americans scale
v045141,H1b. How important is issue of aid to Hispanic-Americans
v045142,H2. What should federal govt do about outsourcing
v045142a,H2a. How much should govt discourage/encourage outsourcing
v045143,H3. Favor allowing Social Sec funds invested in the market
v045143a,H3a. Strength favor/oppose investing Soc Sec funds in mkt
v045143b,H3b. Summary: favor/oppose investing Soc Sec funds
v045144,H4. Does R favor/oppose school vouchers
v045144a,H4a. How strongly does R favor/oppose school vouchers
v045145,H5. How good does seeing US flag make R feel
v045145x,H5x. Summary: Pre-Post US flag makes R feel
v045146,H6. Things about America that make R ashamed
v045146x,H6x. Summary: Pre-Post America makes ashamed
v045147,H7. Things about America that make R angry
v045147x,H7x. Summary: Pre-Post America makes angry
v045148,H8. How strong is love for country
v045148x,H8x. Summary: Pre-Post how strong love for country
v045149,H9. How important is being an American
v045149x,H9x. Summary: Pre-Post importance of being American
v045150,J1a. Limit Government: problems have become bigger
v045151,J1b. Limit Government: need strong govt for complex probs
v045152,J1c. Limit Government: less government the better
v045153,J2. Does R ever talk politics with family and friends
v045153a,J2a. How many days in past week R discussed politics
v045154,J3. Does R listen to political talk radio
v045155,J3a. Does R have access to the internet or web
v045155a,J3b. Did R see any information about campaign on Web
v045156,J4a. Should laws protect homosexuals against job discrim
v045156a,J4a1. Strength favor/oppose laws to protect homosexuals
v045157,J4b. Should homosexuals serve in U.S. armed forces
v045157a,J4b1. Strength favor/oppose homosexuals in military
v045158,J4c. Should homosexual couples be allowed to adopt
v045159,J5a. Important differences between Democrats and Repubs
v045160,J5b. Is one party is more conservative at national level
v045160a,J5b1. Which party is more conservative at national level
v045161,J6a. R have interest in equal treatment for women in jobs
v045161a,J6b. R opinion on equal treatment for women in jobs
v045161b,J6c. Strength opinion on equal treatment for women in jobs
v045162,J7a. Politl knowledge office recognition Dennis Hastert
v045162a,J7a1. PROBE used for recognition of Hastert
v045163,J7b. Political knowledge office recognition Dick Cheney
v045163a,J7b1. PROBE used for recognition of Cheney
v045164,J7c. Political knowledge office recognition Tony Blair
v045164a,J7c1. PROBE used for recognition of Blair
v045165,J7d. Political knowledge office recognition Wm Rehnquist
v045165a,J7d1. PROBE used for recognition of Rehnquist
v045166,J8a. R worked/joined organization on community problem
v045167,J8b. Contacted public official to express views
v045168,J8c. Attended community meeting about issue
v045169,J8d. R taken part in Protest or march in last year
v045170,J9a. Is R a member of any organizations
v045170a,J9a1. Number of organizations R is a member of
v045171,J10. Able to devote time to volunteer work in last 12 mo
v045172,"J11. In last 12 mos, made contributions of money to church"
v045173,K0. Summary: R gender/race/ethnicity status
v045174,K1. Is R linked to what happens with women
v045174a,K1a. How much R linked to what happens to women
v045175,K1b. R feeling pride in accomplishments of women
v045176,K1c. R angry about the way women are treated in society
v045177,K2. Is R linked to what happens to blacks
v045177a,K2a. How much R linked to what happens with blacks
v045178,K2b. R feeling pride in accomplishments of blacks
v045179,K2c. R angry about the way blacks are treated in society
v045180,K3. Is R linked to what happens to Hispanics
v045180a,K3a. How much R linked to what happens with Hispanics
v045181,K3b. R feeling pride in accomplishments of Hispanics
v045182,K3c. R angry about the way Hispanics treated in society
v045183,K4a. Women demanding equality seek special favors
v045184,K4b. Women miss good jobs because of discrimination
v045185,K4c.Women complaining abt harassment cause problems
v045186,L1. Would R say most people can be trusted
v045187,L2. Would people try to take advantage of R
v045188,L3. Most people try to be helpful or look out for selves
v045189,L4a. Should adjust moral views to changing world
v045190,L4b. Newer lifestyles causing society breakdown
v045191,L4c. Should be more tolerant of different moral standards
v045192,L4d. Should be more emphasis on traditional family ties
v045193,L5a. Blacks should work their way up like other groups
v045194,L5b. History makes more difficult for blacks to succeed
v045195,L5c. Blacks gotten less than they deserve
v045196,L5d. Blacks should try harder to succeed
v045197,M1a. How often trust government in Washington to do right
v045198,M1b. Is govt run by few big interests or benefit of all
v045199,M1c. How much does government waste tax money
v045200,M1d. How many crooked people running government
v045201,M2a. Public officials don't care what people think
v045202,M2b. People like me don't have any say in what govt does
v045203,M3a. How much attention does govt pay to what people think
v045204,M3b. Elections make govt pay attn to what people think
v045205,M4a. Working mother can have warm relationship with kids
v045206,M4b. Better if woman cares for home-family and man achieve
v045207,M5a. R for or against preference for blacks in jobs
v045207a,M5b. Strength R favors/opposes preference for blacks in jobs
v045208,N1a. Qualities for children: Independent or respect elders
v045209,N1b. Qualities for children: Curiosity or good manners
v045210,N1c. Qualities for children: Obedience or self-reliance
v045211,N1d. Qualities for children: Considerate or well behaved
v045212,N2a. Should do what is necessary for equal opportunity
v045213,N2b. Have gone too far pushing equal rights
v045214,N2c. Big problem is not giving everyone equal chance
v045215,N2d. Better off if worried less about equality
v045216,N2e. Not that big a problem if people have unequal chance
v045217,N2f. Many fewer problems if people treated equally
v045218,P1a. How opinionated is R
v045219,P1b. R have fewer or more opinions than average
v045219a,P1c. R have many or somewhat fewer/more opinions
v045220,P2a. Does R like responsibility for thinking
v045220a,P2b. How much R likes/dislikes responsibility for thinking
v045221,P3. Does R like simple or complex problems
v045222,P4a. Hardworking 7-pt scale: whites
v045223,P4b. Hardworking 7-pt scale: blacks
v045224,P4c. Hardworking 7-pt scale: Hispanic-Americans
v045225,P4d. Hardworking 7-pt scale: Asian-Americans
v045226,P5a. Intelligent 7-pt scale: whites
v045227,P5b. Intelligent 7-pt scale: blacks
v045228,P5c. Intelligent 7-pt scale: Hispanic-Americans
v045229,P5d. Intelligent 7-pt scale: Asian-Americans
v045230,P6a. Trustworthy 7-pt scale: whites
v045231,P6b. Trustworthy 7-pt scale: blacks
v045232,P6c. Trustworthy 7-pt scale: Hispanic-Americans
v045233,P6d. Trustworthy 7-pt scale: Asian-Americans
v045235,Q1a. CSES Did R talk to others to persuade how to vote
v045235a,Q1a1. CSES How often R talked to others about how to vote
v045236,"Q2. CSES Did R attend meeting, etc. for party or candidate"
v045236a,Q2a. CSES How often R attended meeting etc. for party/cand
v045237,Q3. CSES Did candidate or party contact R about vote
v045238,Q4. CSES Most important issue in past 4 years
v045239,Q4a. CSES How well has govt done on most imp issue
v045240,Q5. CSES How good job in general govt has done past 4 yrs
v045241,Q6. CSES How satisfied with democracy in US
v045242,Q7. CSES Makes a difference who is in power
v045243,Q8. CSES Who people vote for makes a difference
v045244,Q9. CSES Democracy is best form of govt
v045245,Q9x. Interviewer checkpoint - party of vote
v045246,Q9a. CSES Party of Pres vote -party performance past 4 yrs
v045247,Q10. CSES Elections ensure voters views are represented
v045248,Q11. CSES Does any party represent Rs views
v045248a,Q11a. CSES Which party represents R's views
v045249,Q12. CSES Does any 2004 Pres cand represent R views
v045249a,Q12a. CSES Which cand in last election represents R views
v045250,Q13. CSES R think of self as close to any party
v045250a,Q13a1. CSES Mention 1 party R thinks of self as close to
v045250b,Q13a2. CSES Mention 2 party R thinks of self as close to
v045251,Q13a0. CSES IWR checkpoint: number of parties R close to
v045252,Q13a1. CSES Which party R feels closest to among multiple
v045253,Q13b. CSES Is R a little closer to one party than others
v045253a,"Q13b1. CSES If a little closer to one party, which one"
v045254,Q13x. CSES Summary: most close party
v045255,Q14. CSES How close to this party
v045257,Q15. CSES Like/dislike scale - Democratic Party
v045258,Q16. CSES Like/dislike scale - Republican Party
v045259,Q17. CSES Like/dislike scale - Reform party
v045260,Q19. CSES Left-right scale - Democratic Party
v045261,Q20. CSES Left-right scale - Republican Party
v045262,Q21. CSES Left-right scale - Reform party
v045263,Q22. CSES Left-right scale - GW Bush
v045264,Q23. CSES Left-right scale - John Kerry
v045265,Q24. CSES Left-right scale - Ralph Nader
v045266,Q25a. CSES Has R contacted politician or govt official
v045267,Q25b. CSES Has R taken part in protest or demonstration
v045268,Q25c. CSES Has R worked with others on shared concern
v045269,Q27a. CSES How much respect for human rights in US
v045270,Q27b. CSES How much corruption in US
v045271,Q28. CSES Left-Right scale - self placement
v045300a,Z1a. Flag Terminology Left-Right
v045300b,Z1b. Flag Terminology Liberal-Conservative
v045301a,ZZ1a. POST IWR obs: others present - children under 6
v045301b,ZZ1b. POST IWR obs: others present - older children
v045301c,ZZ1c. POST IWR obs: others present - spouse
v045301d,ZZ1d. POST IWR obs: others present - other relatives
v045301e,ZZ1e. POST IWR obs: others present - other adults
v045301f,"ZZ1f. POST IWR obs: others present - someone, not sure who"
v045302,ZZ2. POST IWR OBS: R cooperation
v045303,ZZ3. POST IWR OBS: R level of information
v045304,ZZ4. POST IWR OBS: R intelligence
v045305,ZZ5. POST IWR OBS: R suspicious
v045306,ZZ6. POST IWR OBS: R interest in IW
v045307,ZZ7. POST IWR OBS: R sincere
v045307a,ZZ7a. POST IWR OBS: places where doubted R sincerity
v045308a,ZZ8a. POST IWR OBS: Mention 1 - R reactions to IW
v045308b,ZZ8b. POST IWR OBS: Mention 2 - R reactions to IW
v045308c,ZZ8c. POST IWR OBS: Mention 3 - R reactions to IW
v045308d,ZZ8d. POST IWR OBS: Mention 4 - R reactions to IW
v045308e,ZZ8e. POST IWR OBS: Mention 5 - R reactions to IW
v045308f,ZZ8f. POST IWR OBS: Mention 6 - R reactions to IW
v045308g,ZZ8g. POST IWR OBS: Mention 7 - R reactions to IW